number,value,datetime_start,datetime_complete,duration,params_T_max,params_clip_epsilon,params_entropy_coef,params_eta_min,params_gae_lambda,params_gamma,params_lr,params_scheduler,params_value_loss_coef,state
176,,2025-03-15 17:50:01.107210,2025-03-15 18:03:30.864096,0 days 00:13:29.756886,48,0.22710536656975913,0.0010569710073790718,2.0217098856031876e-06,0.9333206634201696,0.9539759814947476,0.0006909293103132116,step,0.7016503615697821,FAIL
177,73.61111068725586,2025-03-15 17:56:01.951680,2025-03-15 18:09:21.627551,0 days 00:13:19.675871,50,0.2227732024994692,0.0003098102320169699,5.37150732253648e-07,0.9331965331447043,0.9527436904947442,0.0003559893644856852,step,0.7800605893588507,COMPLETE
178,,2025-03-15 18:04:00.207563,2025-03-15 18:09:24.273355,0 days 00:05:24.065792,50,0.20677099663553664,0.00205563224398241,9.109976670269452e-07,0.9512420927910333,0.9782030664963131,8.150173672620952e-05,cosine,0.9577730114824031,FAIL
179,,2025-03-15 18:04:00.903360,2025-03-15 18:09:27.710820,0 days 00:05:26.807460,49,0.1719789830550008,0.002636641785145376,5.675322448215172e-07,0.9394689902384856,0.985997350985974,0.0008382607472283289,cosine,0.9725684908092824,FAIL
180,,2025-03-15 18:04:00.918698,2025-03-15 18:09:24.699917,0 days 00:05:23.781219,48,0.2844928492624035,0.0026623981402590833,4.121776967494399e-07,0.929960500481431,0.9550496959325375,0.0008542372778648733,step,0.5098990901808254,FAIL
181,,2025-03-15 18:10:57.672217,2025-03-15 18:27:29.391832,0 days 00:16:31.719615,46,0.23609004880854345,0.000661628923461543,9.059169543025389e-07,0.943117432245095,0.9715714801309461,0.00020749249688352847,cosine,0.9562416518218249,FAIL
182,,2025-03-15 18:11:02.176963,2025-03-15 18:11:28.590563,0 days 00:00:26.413600,44,0.2865427358697617,0.0024067092964928814,1.4366020153158445e-07,0.9548035211021578,0.9899409758682994,0.0001603660992510355,step,0.3600803276648249,FAIL
183,,2025-03-15 18:11:05.112538,2025-03-15 18:22:50.928892,0 days 00:11:45.816354,47,0.2341456975026281,0.0029165558453880885,6.213607863415395e-07,0.9631581512188108,0.9751312728911243,0.00044021369631665685,cosine,0.9434852757829503,FAIL
184,,2025-03-15 18:11:05.328540,2025-03-15 18:16:49.979890,0 days 00:05:44.651350,50,0.09646808239820139,0.0038807026620133176,5.594583434724792e-07,0.91282041176516,0.9737152944629099,0.00041796785543780717,cosine,0.9036589722781858,FAIL
185,115.83333333333333,2025-03-15 18:12:12.622716,2025-03-15 18:27:24.184171,0 days 00:15:11.561455,35,0.2635678924743098,0.000633383746183769,6.217025104343195e-07,0.9433956237877622,0.9592216067267848,0.0003736212423143828,step,0.587329911454856,COMPLETE
186,,2025-03-15 18:17:34.484152,2025-03-15 18:27:29.404379,0 days 00:09:54.920227,47,0.26318079233857916,0.00208885089050501,4.0861588392372025e-07,0.9401224905635444,0.951429859737878,0.00035946824901744533,step,0.26332069950349496,FAIL
187,,2025-03-15 18:23:30.820687,2025-03-15 18:27:29.899062,0 days 00:03:59.078375,45,0.2500410892041173,0.0017997086200692567,1.4241211108438317e-07,0.9358406249551244,0.998053213948998,0.0004146664725670095,step,0.15897343665621883,FAIL
188,48.513888676961265,2025-03-15 18:29:00.559708,2025-03-15 18:42:52.350535,0 days 00:13:51.790827,48,0.23081373581318174,0.0014890468466866738,4.203776466014399e-06,0.9484966301963755,0.9854455477185158,0.000419428400307922,cosine,0.9232374025024535,COMPLETE
189,,2025-03-15 18:29:00.860936,2025-03-15 18:42:55.098889,0 days 00:13:54.237953,42,0.2577374485011733,0.000216172233992592,2.340587298641366e-06,0.9821494449441818,0.9850455757656372,0.0007915650962047209,cosine,0.8609593334857083,FAIL
190,,2025-03-15 18:29:00.863301,2025-03-15 18:42:56.223726,0 days 00:13:55.360425,50,0.27832243982103344,0.001564138371554458,2.2865548220228032e-07,0.9594143304593804,0.9580282952521633,0.000740171355049265,step,0.674649548942047,FAIL
191,,2025-03-15 18:29:01.818149,2025-03-15 18:42:58.406697,0 days 00:13:56.588548,46,0.23077637352355218,0.0005511722527216175,7.217505742785604e-07,0.9403456545021609,0.9504959672398613,0.0004975040672928345,cosine,0.22640773066095587,FAIL
192,,2025-03-15 18:44:32.581475,2025-03-15 18:44:46.768545,0 days 00:00:14.187070,49,0.22743799024960754,0.002983149360929508,1.140543800199392e-06,0.956432251961599,0.9740430080645847,0.00017656626304201378,cosine,0.9778449328265468,FAIL
193,,2025-03-15 18:44:36.040363,2025-03-15 18:44:53.026473,0 days 00:00:16.986110,44,0.29229594622840027,0.0008111976185472843,9.041867796412777e-07,0.9283498801754776,0.957428515451256,0.0001334469461435794,cosine,0.5908159964426858,FAIL
194,,2025-03-15 18:44:36.052165,2025-03-15 18:44:51.048473,0 days 00:00:14.996308,47,0.2894446175908493,0.002948663979053096,3.794965098275335e-07,0.9356692772705206,0.959907508493025,0.00024900900066498875,step,0.5959518576919999,FAIL
195,,2025-03-15 18:44:36.051754,2025-03-15 18:44:54.844827,0 days 00:00:18.793073,36,0.28329341979342154,0.000658694696387441,3.67606020838246e-06,0.9874033565416526,0.9925336168884314,0.0004978966060392063,cosine,0.5267087655470508,FAIL
196,,2025-03-15 18:45:28.890355,2025-03-15 18:45:44.217007,0 days 00:00:15.326652,43,0.18955539838538202,0.013234029276513402,5.087180562359637e-07,0.9461975011182931,0.9783169507169327,0.00012816690803100947,cosine,0.9182215056448897,FAIL
197,,2025-03-15 18:45:29.086635,2025-03-15 18:45:44.215480,0 days 00:00:15.128845,40,0.20346993787199746,0.0010684718032993674,1.4054183226060606e-07,0.9447819850984854,0.9895337883972462,0.0007876788580978457,step,0.4442748842432199,FAIL
198,,2025-03-15 18:45:34.169892,2025-03-15 18:45:46.767769,0 days 00:00:12.597877,38,0.29470013276024853,0.001665475407175691,1.690831083543671e-07,0.9456486554483572,0.9894250765004372,0.0006705253773823891,step,0.1779654101849318,FAIL
199,,2025-03-15 18:45:34.408392,2025-03-15 18:45:48.945096,0 days 00:00:14.536704,49,0.241745574787325,0.0009783024507219722,2.0672684552029096e-07,0.9489248740622727,0.9949856242031611,0.0005910863894019961,step,0.24430491922534214,FAIL
200,,2025-03-15 18:46:33.118202,2025-03-15 18:46:50.190813,0 days 00:00:17.072611,50,0.2918952635957243,0.0028655098828625465,1.9589953689949175e-07,0.9421207428619843,0.9500451199344461,0.0004350904853758026,step,0.7246512383676043,FAIL
201,,2025-03-15 18:46:33.352990,2025-03-15 18:46:48.775793,0 days 00:00:15.422803,50,0.2656940360133887,0.0005508870878755235,3.498995204891767e-07,0.9618969916325427,0.970592924779097,0.0008156417995800486,cosine,0.7163627306209731,FAIL
202,,2025-03-15 18:46:33.137050,2025-03-15 18:46:47.544714,0 days 00:00:14.407664,44,0.20709321696044986,0.0007241770013890024,2.0014137667957412e-07,0.9486171189121247,0.9946329802091323,0.0006463515417657728,step,0.37388431406968314,FAIL
203,,2025-03-15 18:46:40.625478,2025-03-15 18:46:53.266054,0 days 00:00:12.640576,49,0.23320020631417587,0.004362826384540304,1.4882524693617547e-07,0.9643737854278588,0.9864414843741662,0.0003337237316228645,cosine,0.9662030933195519,FAIL
204,,2025-03-15 18:47:43.070860,2025-03-15 18:47:56.731925,0 days 00:00:13.661065,50,0.28620638438496093,0.0008915112490941,2.0598056918872646e-06,0.9162190142429303,0.951840862670565,0.00022174968889296915,cosine,0.6777666942847441,FAIL
