number,value,datetime_start,datetime_complete,duration,params_T_max,params_clip_epsilon,params_entropy_coef,params_eta_min,params_gae_lambda,params_gamma,params_lr,params_scheduler,params_value_loss_coef,state
87,,2025-03-14 03:32:23.273149,2025-03-14 03:45:40.496140,0 days 00:13:17.222991,43,0.27440485016734106,0.0005945728331045723,2.2327540592698273e-07,0.9575579300129847,0.9789761277405942,0.0007296397451088582,cosine,0.4503429788174634,FAIL
88,,2025-03-14 03:32:23.861363,2025-03-14 03:45:40.815997,0 days 00:13:16.954634,49,0.265860619007575,0.003334640746766394,1.3818126231511227e-06,0.9630183158204084,0.997551092598439,0.0009331317625960265,cosine,0.8929705971738586,FAIL
89,127.83333333333333,2025-03-14 03:45:15.234353,2025-03-14 03:57:52.681186,0 days 00:12:37.446833,42,0.2922501321634734,0.002844668449179132,1.4150850796519661e-06,0.9620433979461331,0.9925934498951534,0.0004729481181854968,cosine,0.7493766069716047,COMPLETE
90,,2025-03-14 03:46:50.911727,2025-03-14 04:00:04.988650,0 days 00:13:14.076923,50,0.21280598767368117,0.000576454307105607,7.399309358018333e-07,0.9475622514214342,0.9835495973059518,0.00037579518732405395,cosine,0.9779136685850778,FAIL
91,,2025-03-14 03:46:53.575091,2025-03-14 03:58:39.142939,0 days 00:11:45.567848,42,0.24566384169414757,0.0003203207336507112,4.012947444493827e-06,0.9506294813249171,0.9897211466429902,0.0009672170820317582,cosine,0.8166183159738192,FAIL
92,64.82222366333008,2025-03-14 03:46:53.911101,2025-03-14 04:00:02.442223,0 days 00:13:08.531122,45,0.23567549810836128,0.0003849432180395667,3.867123344350875e-06,0.9644434751694021,0.9718486049699461,0.0009960787942256016,step,0.9462724774641801,COMPLETE
93,97.51851908365886,2025-03-14 03:58:59.399302,2025-03-14 04:11:56.691903,0 days 00:12:57.292601,36,0.24443909686991633,0.004945641645272642,7.062893928395986e-07,0.9738578965723229,0.9899773157059878,0.00037110387101275196,cosine,0.7218163592527496,COMPLETE
94,,2025-03-14 03:59:15.432224,2025-03-14 04:00:05.852201,0 days 00:00:50.419977,45,0.23796216646388554,0.002262346898132018,1.3676301177109856e-06,0.9607074096289533,0.9978590357502084,0.00048751898918744625,cosine,0.7318672022475097,FAIL
95,,2025-03-14 04:01:18.139942,2025-03-14 04:14:43.703171,0 days 00:13:25.563229,44,0.2223998109269307,0.0020937551264379405,1.368867102999291e-06,0.9546961351368437,0.9872820985806045,0.0009575498563865667,cosine,0.7429114774120507,FAIL
96,,2025-03-14 04:01:20.827734,2025-03-14 04:14:43.704853,0 days 00:13:22.877119,44,0.22052147996626087,0.00015668336314911851,1.4544000745558614e-06,0.9428024615051113,0.9651977259604793,0.00018422510275199899,step,0.14407882570663916,FAIL
97,113.77777862548828,2025-03-14 04:01:20.829230,2025-03-14 04:14:40.801969,0 days 00:13:19.972739,40,0.2987761978141246,0.003452965143295435,1.2995705307171312e-06,0.9539974608851894,0.9921609871425829,0.0004701078988601517,cosine,0.8272662785808883,COMPLETE
98,101.01719665527344,2025-03-14 04:13:05.807331,2025-03-14 04:25:49.502025,0 days 00:12:43.694694,47,0.2635902714014462,0.005950417045868329,1.224034072364368e-07,0.9508109800653268,0.9556629751562703,0.0008600375752131059,cosine,0.444493690337216,COMPLETE
99,,2025-03-14 04:15:49.941387,2025-03-14 04:29:06.552233,0 days 00:13:16.610846,47,0.2710928433330654,0.001183640125234463,8.084282337173599e-07,0.9282973235084518,0.951099323347231,0.00016406603198794922,cosine,0.2505723988006515,FAIL
100,120.58333333333333,2025-03-14 04:15:53.142045,2025-03-14 04:29:02.885485,0 days 00:13:09.743440,50,0.1749548045072019,0.003720380515770755,1.2469741595196207e-06,0.948771151880843,0.9845843104215032,0.00040943229505368753,cosine,0.9986061703772484,COMPLETE
101,,2025-03-14 04:15:55.779738,2025-03-14 04:29:06.871809,0 days 00:13:11.092071,45,0.29373827604529645,0.00016602140176466697,1.5800812593738871e-06,0.9271038378538456,0.9692015760717243,0.0004224018555082595,step,0.20017757168492425,FAIL
102,81.41071446736653,2025-03-14 04:27:01.702901,2025-03-14 04:39:52.218243,0 days 00:12:50.515342,43,0.27391823577946683,0.008351003253167342,7.63590337793229e-07,0.9542659315131252,0.9649958823352062,0.0003036188064430367,step,0.6061446619405491,COMPLETE
103,,2025-03-14 04:30:12.691404,2025-03-14 04:43:18.922468,0 days 00:13:06.231064,47,0.1807742956444594,0.004009458758330335,2.4020454528219525e-06,0.9558903528047477,0.9884761021689528,0.00010657501680342875,cosine,0.9115248263766482,FAIL
104,37.92698415120443,2025-03-14 04:30:13.006781,2025-03-14 04:43:16.404845,0 days 00:13:03.398064,38,0.1319390452616481,0.003897345362330288,5.769134033068806e-07,0.956285382531638,0.9794293037027304,0.0007295019406599452,cosine,0.8609884014122134,COMPLETE
105,,2025-03-14 11:48:57.957102,2025-03-14 11:49:22.572491,0 days 00:00:24.615389,48,0.28488324960799527,0.0005965528661195453,8.7736111496419e-07,0.9205596923579336,0.9547017874212904,5.445513110366995e-05,step,0.27875215213813553,FAIL
106,,2025-03-14 11:48:57.961779,2025-03-14 11:49:22.573519,0 days 00:00:24.611740,43,0.22036605904813023,0.0012129978930945373,1.1308427705573976e-06,0.9445793956282107,0.9855302124367709,0.00026353224812259525,cosine,0.9281871256459111,FAIL
107,,2025-03-14 11:48:57.960857,2025-03-14 11:49:22.573084,0 days 00:00:24.612227,49,0.2801730107677952,0.0012566593094746872,2.303252396601295e-07,0.9257527046453288,0.9589671812015478,0.00037088596106937187,step,0.4947841024233243,FAIL
108,,2025-03-14 11:48:57.973070,2025-03-14 11:53:51.535488,0 days 00:04:53.562418,48,0.2427325500270867,0.0009105388392752674,1.3796092873494818e-06,0.9210039750615363,0.9631993473796656,0.0006321814266915662,step,0.49491186788269514,FAIL
109,63.791666666666664,2025-03-14 11:49:49.475311,2025-03-14 12:04:09.504675,0 days 00:14:20.029364,46,0.23575986481817066,0.011831802751503466,1.3149328997311357e-06,0.9224085263262867,0.9905662181336514,0.0005349114774221605,cosine,0.9871185271509467,COMPLETE
110,,2025-03-14 11:49:52.748033,2025-03-14 12:04:19.123247,0 days 00:14:26.375214,42,0.2401433872198559,0.0009506405958181717,8.968498225757542e-07,0.9666084727265112,0.9694770617295096,0.00010230170259987659,step,0.12072491503143273,FAIL
111,,2025-03-14 11:49:52.763043,2025-03-14 11:54:07.937801,0 days 00:04:15.174758,46,0.19420945942691567,0.001158804640556521,1.028616821302969e-06,0.9310374359902026,0.9912965773095961,0.00012343234271066262,cosine,0.9872899483831794,FAIL
112,,2025-03-14 11:54:22.644698,2025-03-14 11:58:39.498101,0 days 00:04:16.853403,50,0.15556500978391635,0.001566075731598534,2.604041728379802e-06,0.9426958370645525,0.9935879208341898,0.0002670636276342804,cosine,0.8619045529516333,FAIL
113,,2025-03-14 11:54:38.828507,2025-03-14 11:56:55.160853,0 days 00:02:16.332346,42,0.20359345938438134,0.001696309810502124,5.311378142236452e-06,0.9423099277467034,0.9847797265550026,0.0009357966822313139,cosine,0.9550800870558881,FAIL
114,,2025-03-14 11:57:27.088368,2025-03-14 12:04:18.415494,0 days 00:06:51.327126,49,0.21645709387075385,0.0004935154872968563,7.937501777071877e-07,0.9468973732861576,0.9698226897173576,0.00014363942496461315,step,0.31867753528405074,FAIL
115,,2025-03-14 11:59:09.369116,2025-03-14 12:04:17.069755,0 days 00:05:07.700639,46,0.16118876198583926,0.0008822531131962341,2.9761334682869613e-06,0.9428805216983636,0.9891077617949808,0.0006391446175651303,cosine,0.970952571267371,FAIL
116,,2025-03-14 12:05:53.255539,2025-03-14 12:06:09.719570,0 days 00:00:16.464031,50,0.24299800183731535,0.0013795532626258915,1.9401303400992903e-06,0.9349909613257379,0.9602405113479748,0.00044224361747568645,step,0.2532873981854953,FAIL
117,,2025-03-14 12:05:53.259285,2025-03-14 12:09:20.248571,0 days 00:03:26.989286,48,0.21605711998844013,0.001173885870681632,7.069033182409495e-07,0.9249956571476042,0.97077230353441,0.0007630335132574709,cosine,0.9453827550843141,FAIL
118,132.39285786946616,2025-03-14 12:05:53.256545,2025-03-14 12:21:02.661675,0 days 00:15:09.405130,49,0.24977415291634972,0.0020622640186278617,1.1118758808300782e-07,0.9461413974687652,0.9932907418871657,0.0007112714510323691,step,0.2642195827652803,COMPLETE
119,86.19444529215495,2025-03-14 12:05:53.264198,2025-03-14 12:20:55.498138,0 days 00:15:02.233940,49,0.29805467028940846,0.004853877647947538,2.232627134479359e-07,0.9310047656635136,0.9870992754955151,0.0007556528353482968,step,0.4114964484964476,COMPLETE
120,,2025-03-14 12:06:34.205694,2025-03-14 12:21:03.154591,0 days 00:14:28.948897,47,0.18366343093443424,0.002553617345957925,7.343565185674709e-07,0.9537959985835996,0.9833763159581054,0.0008796070529654159,cosine,0.9553865541555064,FAIL
121,,2025-03-14 12:09:46.950196,2025-03-14 12:21:03.149540,0 days 00:11:16.199344,45,0.27358045196495623,0.0011337881462293482,9.78538889572823e-07,0.9418741505326745,0.9511687052433552,0.0004492338685131609,step,0.12082799262141175,FAIL
122,102.4087282816569,2025-03-14 12:22:39.878796,2025-03-14 12:36:50.591612,0 days 00:14:10.712816,41,0.15833385212831372,0.0007950149119641982,2.116460140974382e-06,0.947174959318182,0.9926591369047187,0.0005020471755634671,cosine,0.9418300343763583,COMPLETE
123,,2025-03-14 12:22:39.881672,2025-03-14 12:23:02.216483,0 days 00:00:22.334811,45,0.2602385120211414,0.0014826595994027981,1.085536209739289e-07,0.9517071876825094,0.9918280905236195,0.00046541504924804607,step,0.2728796108053902,FAIL
124,,2025-03-14 12:22:39.889063,2025-03-14 12:23:02.217633,0 days 00:00:22.328570,50,0.13871000964183428,0.007170425917657397,1.414489988880334e-06,0.9620098861749434,0.9912556341109351,0.00036764985667489796,cosine,0.9095147346917756,FAIL
125,,2025-03-14 12:22:39.898387,2025-03-14 12:30:00.063593,0 days 00:07:20.165206,49,0.18006916726998573,0.0014206830666016691,1.1911167462743511e-07,0.9242861415876813,0.9937766752047277,0.0008388606839692858,cosine,0.20296889350855668,FAIL
126,,2025-03-14 12:23:29.047136,2025-03-14 12:36:55.910904,0 days 00:13:26.863768,44,0.18809414615704217,0.0005622393736890961,2.125697868321677e-06,0.9401939632804732,0.9797745538913581,0.00043604263878416433,cosine,0.9980030886720312,FAIL
127,,2025-03-14 12:23:31.927093,2025-03-14 12:36:56.950476,0 days 00:13:25.023383,44,0.2879215000856869,0.0007036451894648598,1.398294415583669e-06,0.9117580259842946,0.9613413311952321,0.0002072078474187221,step,0.4787182765950666,FAIL
128,,2025-03-14 12:30:25.047302,2025-03-14 12:36:56.541454,0 days 00:06:31.494152,50,0.18557875988511152,0.000293196145797411,1.1061270042275347e-06,0.9367943835347732,0.9752247976553582,0.0005699519244065086,cosine,0.9683598734728782,FAIL
129,,2025-03-14 12:37:58.768954,2025-03-14 12:38:09.906303,0 days 00:00:11.137349,48,0.21415547515425046,0.0038096562449935058,1.3160118151876434e-06,0.981336318487836,0.9846107572690397,0.0005066861302407185,cosine,0.9611232124340482,FAIL
130,,2025-03-14 12:38:01.487258,2025-03-14 12:38:12.914203,0 days 00:00:11.426945,46,0.2677467096090077,0.006335300453264407,2.0644938485490653e-07,0.962911283961979,0.9980949254734065,0.0007674544370799306,step,0.300907805168949,FAIL
131,,2025-03-14 12:38:03.857121,2025-03-14 12:38:17.199734,0 days 00:00:13.342613,46,0.2202432390386514,0.0007218412897408643,1.423053839353297e-07,0.9612154186741713,0.9908020561978589,0.000741410879289192,step,0.16313219634785125,FAIL
132,,2025-03-14 12:38:03.862006,2025-03-14 12:38:17.482165,0 days 00:00:13.620159,48,0.27527100275773375,0.0003463223613306427,1.1525638600764492e-07,0.9561097293451706,0.9947722505220724,0.0003560829708796587,step,0.2872599073984903,FAIL
133,,2025-03-14 12:38:36.071398,2025-03-14 12:38:47.451528,0 days 00:00:11.380130,44,0.22354973113749985,0.008168770677461868,2.943961399571214e-07,0.962615228473409,0.996632704362667,0.0009109756648131159,step,0.15920994406189792,FAIL
134,,2025-03-14 12:38:36.739007,2025-03-14 12:38:49.379104,0 days 00:00:12.640097,42,0.2825960577244314,0.0004957333153743252,1.343940716897418e-06,0.925397477381758,0.9579962135436476,0.00024703409121269753,step,0.32787221666565747,FAIL
135,,2025-03-14 12:38:41.749594,2025-03-14 12:38:51.948287,0 days 00:00:10.198693,42,0.2445826093201425,0.0020408660825471762,1.135706298108846e-06,0.9202596887860807,0.9730613247548877,0.0004306387270044447,step,0.1347446879076554,FAIL
136,,2025-03-14 12:38:44.746560,2025-03-14 12:38:54.958844,0 days 00:00:10.212284,44,0.2491392144665601,0.0010945223285420782,1.0215643446057732e-07,0.9512362251009541,0.9960855587389728,0.0006189219839236806,step,0.278677212982944,FAIL
137,,2025-03-14 12:39:12.806328,2025-03-14 12:39:24.099909,0 days 00:00:11.293581,44,0.26350412907763127,0.0006822838739359422,6.733374860383828e-07,0.9090107608259976,0.9568548953576471,0.00011376102663182,step,0.16092587007927,FAIL
138,,2025-03-14 12:39:16.012031,2025-03-14 12:39:26.839689,0 days 00:00:10.827658,42,0.23872502621368255,0.001548712674307447,3.289643971464174e-07,0.953252975692769,0.9981216379606419,0.0007391228117065451,step,0.23528190762976847,FAIL
139,,2025-03-14 12:39:18.789362,2025-03-14 12:39:30.189213,0 days 00:00:11.399851,36,0.19173225074685749,0.004311591538676104,2.806772530386047e-07,0.938137068195919,0.9989507888277603,0.0007539556471891668,step,0.20096154810740563,FAIL
140,,2025-03-14 12:39:21.803473,2025-03-14 12:39:33.476951,0 days 00:00:11.673478,39,0.27411635653680727,0.0003107246226488684,1.2944705086315592e-06,0.9074581086049027,0.9625450253679693,0.00021115106654344824,step,0.42548093897459394,FAIL
141,,2025-03-14 12:39:51.048247,2025-03-14 12:40:02.126324,0 days 00:00:11.078077,48,0.1822701178755009,0.00158760708127795,1.2028284832999147e-06,0.9684171943996345,0.9716337267391749,0.00046896909030466486,cosine,0.8630982969706873,FAIL
142,,2025-03-14 12:39:58.546214,2025-03-14 12:40:10.110927,0 days 00:00:11.564713,47,0.29728458462350116,0.0039773493730145375,1.3507830827374945e-07,0.9600484591268718,0.9920266539910949,0.0005244898343004551,step,0.16372326273304216,FAIL
143,,2025-03-14 12:40:01.925893,2025-03-14 12:40:12.856285,0 days 00:00:10.930392,41,0.23172984254588525,0.01963548250882898,1.2424780940948332e-07,0.9574138923922046,0.9983097258466905,0.0005022821903045785,step,0.1940426716323451,FAIL
144,,2025-03-14 12:40:27.397882,2025-03-14 12:40:39.154669,0 days 00:00:11.756787,44,0.2805694021811994,0.0009283682701802369,7.471844143175398e-07,0.9442885753801405,0.966334066942756,0.0006949012407946304,step,0.5562442344182074,FAIL
145,,2025-03-14 12:40:34.752674,2025-03-14 12:40:46.260894,0 days 00:00:11.508220,48,0.27371618966098693,0.0021367198003375905,9.130052671981031e-07,0.9195496125205039,0.9627042319885384,0.000399264830418878,step,0.41263673214267715,FAIL
146,,2025-03-14 12:40:37.300901,2025-03-14 12:40:48.326390,0 days 00:00:11.025489,44,0.21272936534609213,0.0028476657965254165,3.336612596554155e-07,0.9711376601083298,0.9575066010693758,0.00020958571514258207,step,0.13912426206357253,FAIL
147,,2025-03-14 12:41:03.348792,2025-03-14 12:41:14.831755,0 days 00:00:11.482963,50,0.2200300598154651,0.003653847494380841,2.4872631550993982e-06,0.969084965607216,0.9913690286940932,0.00036675290778115334,cosine,0.9436070760231524,FAIL
148,,2025-03-14 12:41:12.227486,2025-03-14 12:41:24.512501,0 days 00:00:12.285015,46,0.2879802653502851,0.0016413257132115832,5.462640361764144e-07,0.94222665449645,0.951985821633882,0.0009559594258599914,step,0.4277989906748985,FAIL
149,,2025-03-14 12:41:12.603905,2025-03-14 12:41:26.065267,0 days 00:00:13.461362,49,0.256439067707238,0.0023861331676830492,2.3789113912134048e-07,0.9156929046564933,0.9567193411401584,9.255809160932401e-05,step,0.2647702107422316,FAIL
150,,2025-03-14 12:41:41.209312,2025-03-14 12:41:53.479574,0 days 00:00:12.270262,41,0.257696390445241,0.005710702776017506,1.86170933187864e-07,0.9547370408466049,0.9959434506553974,0.0003898283974265976,step,0.3956019678136843,FAIL
151,14.689814567565918,2025-03-14 12:41:45.938882,2025-03-14 12:54:58.694566,0 days 00:13:12.755684,43,0.27398189988227695,0.00026010903947923,8.348796880716567e-07,0.9463413840920883,0.9658679988068017,4.139942440594556e-05,step,0.363291428289339,COMPLETE
152,,2025-03-14 12:41:50.567990,2025-03-14 12:42:02.388836,0 days 00:00:11.820846,47,0.24056102159943896,0.0032831424987196695,3.8973196037343417e-07,0.9116563937755242,0.9595011020915883,0.0009297168318959152,step,0.6230351835986904,FAIL
153,,2025-03-14 12:41:50.929044,2025-03-14 12:42:03.953839,0 days 00:00:13.024795,47,0.2351274019826862,0.0004674135344764628,4.082581700575485e-07,0.9106293895358304,0.9522772985813223,0.0003302216910956117,step,0.34009202725206916,FAIL
154,,2025-03-14 12:42:16.813998,2025-03-14 12:42:28.098214,0 days 00:00:11.284216,44,0.2962915826554708,0.00281316386611406,1.1183937500989542e-07,0.9652887896919504,0.9979857054227613,0.0006427364643588715,step,0.1291764778859377,FAIL
155,,2025-03-15 17:03:08.073853,2025-03-15 17:05:40.335433,0 days 00:02:32.261580,40,0.15921461612178206,0.0012843631747051524,1.2492250768614986e-07,0.9349062769480279,0.998972965693057,0.0003492581486891506,step,0.30172712952224634,FAIL
156,76.42261759440105,2025-03-15 17:03:08.074495,2025-03-15 17:17:37.844955,0 days 00:14:29.770460,50,0.26616351452363574,0.00033049283898545364,1.3728735892995295e-06,0.9439337618535366,0.9663309730737403,0.0004596996399136982,step,0.2429828070090661,COMPLETE
157,,2025-03-15 17:03:08.078732,2025-03-15 17:16:47.026133,0 days 00:13:38.947401,50,0.1850512857131237,0.0025787304625045776,5.155544858813955e-07,0.9631855156912374,0.9952081185236048,0.0001188304654333303,cosine,0.9856476712191824,FAIL
158,,2025-03-15 17:03:08.091198,2025-03-15 17:04:06.201512,0 days 00:00:58.110314,48,0.2373553371246111,0.0026612203868363374,8.32767223112973e-07,0.9338542870888182,0.967853149938859,0.00017064098407145896,step,0.22232674292147547,FAIL
159,,2025-03-15 17:04:35.119137,2025-03-15 17:17:41.854360,0 days 00:13:06.735223,45,0.29859127426196097,0.00019737317865382547,8.255138606097545e-07,0.9343958018088552,0.9555500828508998,0.0005347303224911649,cosine,0.5485840385284583,FAIL
160,,2025-03-15 17:06:07.286238,2025-03-15 17:17:41.028179,0 days 00:11:33.741941,47,0.2638673818944227,0.0006195403622975877,5.516023039215381e-07,0.9087036059663014,0.9561748228810897,0.0008408377491625168,step,0.539183214799094,FAIL
161,,2025-03-15 17:17:18.767284,2025-03-15 17:17:40.767123,0 days 00:00:21.999839,48,0.2244875209094919,0.001138764703755772,1.4962289646255626e-06,0.9468024366928649,0.9876925495783959,0.00044090103156673946,cosine,0.9495584036080926,FAIL
162,,2025-03-15 17:19:12.757014,2025-03-15 17:22:35.470716,0 days 00:03:22.713702,50,0.28415164208625776,0.0033573667771492916,3.753443066787198e-07,0.9114206909026215,0.9693548138349054,0.00016008121615949703,step,0.46992633328741135,FAIL
163,,2025-03-15 17:19:12.757396,2025-03-15 17:19:40.053121,0 days 00:00:27.295725,50,0.2149474678475142,0.0004605090144144137,1.8876754432553947e-06,0.9496255081398838,0.973026968063673,0.00033224613145983983,cosine,0.8810872769031051,FAIL
164,,2025-03-15 17:19:13.507851,2025-03-15 17:33:22.688301,0 days 00:14:09.180450,39,0.2851589993479354,0.0007815411757039485,1.8715300437214834e-07,0.9585369502432272,0.9949822906062449,0.0006542972824120373,step,0.2611752873959648,FAIL
165,124.14285786946614,2025-03-15 17:19:13.730691,2025-03-15 17:33:19.278780,0 days 00:14:05.548089,47,0.29832168107929735,0.0008546291015745541,6.459185408595883e-07,0.9271247993848717,0.9575822203293869,0.00024873535965830486,step,0.6426844550820048,COMPLETE
166,,2025-03-15 17:20:07.695415,2025-03-15 17:33:23.767084,0 days 00:13:16.071669,39,0.295329577600272,0.0026962185373273564,1.263819546223788e-07,0.9503730143108481,0.9942399886187437,0.0006245843014862308,step,0.19022534486769915,FAIL
167,,2025-03-15 17:23:03.451239,2025-03-15 17:33:23.267863,0 days 00:10:19.816624,37,0.23101576309816416,0.0049316254438524195,1.420249227844606e-07,0.9265429833768842,0.993176300397243,0.0003412918950635361,step,0.2117546575411041,FAIL
168,85.48412577311198,2025-03-15 17:34:32.256686,2025-03-15 17:48:51.390800,0 days 00:14:19.134114,47,0.2581746033211365,0.002001101945773534,5.747397803000371e-07,0.9078246959518341,0.9551450766470353,0.00022319715494016317,step,0.5191198989635315,COMPLETE
169,,2025-03-15 17:34:34.899049,2025-03-15 17:38:35.674790,0 days 00:04:00.775741,40,0.23327714592261456,0.002274763159207284,3.3528883108150704e-07,0.9274439795647257,0.9555980933301167,0.0005401701629449479,step,0.9078439003111748,FAIL
170,,2025-03-15 17:34:35.149340,2025-03-15 17:48:53.032348,0 days 00:14:17.883008,40,0.2955512255484117,0.0007842972369467889,8.282857957968097e-07,0.9290661658058554,0.9607841914894718,0.0005507525307020473,cosine,0.5054230515504585,FAIL
171,84.82870356241862,2025-03-15 17:34:35.162827,2025-03-15 17:48:50.927657,0 days 00:14:15.764830,44,0.2607964083851073,0.0011302943753796922,8.463751163123163e-07,0.9093274256542898,0.9635353139744564,6.074366215935342e-05,step,0.6701737152371219,COMPLETE
172,,2025-03-15 17:39:02.901836,2025-03-15 17:48:53.032208,0 days 00:09:50.130372,48,0.17253148757707717,0.0035186486724504548,6.219791876477642e-07,0.9169404680785234,0.9669367109048292,0.00010940172506880593,cosine,0.9874599716725745,FAIL
173,67.30952390034993,2025-03-15 17:49:57.856833,2025-03-15 18:03:28.864279,0 days 00:13:31.007446,48,0.23336709618824816,0.023365815631109527,1.0367510328388522e-07,0.9725764949756307,0.9958413814316757,0.0007681659200773964,step,0.3160963363889822,COMPLETE
174,,2025-03-15 17:50:00.840203,2025-03-15 17:54:46.515466,0 days 00:04:45.675263,39,0.2750452965351194,0.0004497561724751467,1.2580723398661623e-06,0.9392345614109701,0.9501484651938488,0.0005266325190978569,step,0.7716621893708309,FAIL
175,,2025-03-15 17:50:01.097392,2025-03-15 18:03:30.864100,0 days 00:13:29.766708,34,0.2717884511457109,0.0002838551036401763,1.8772931167951609e-06,0.9431591605395644,0.9535597046213974,0.00026826326606604363,step,0.8073365345676878,FAIL
